!SESSION 2020-06-20 19:16:01.093 -----------------------------------------------
eclipse.buildId=unknown
java.version=1.8.0_181
java.vendor=Oracle Corporation
BootLoader constants: OS=linux, ARCH=x86_64, WS=gtk, NL=en_US
Framework arguments:  --console -tc config/LassoRankerBoogie.xml -i ./C_Boogie//Overflow_false-no-overflow_true-termination.bpl
Command-line arguments:  -os linux -ws gtk -arch x86_64 -consoleLog --console -data @user.home/.ultimate -tc config/LassoRankerBoogie.xml -i ./C_Boogie//Overflow_false-no-overflow_true-termination.bpl

!ENTRY org.eclipse.core.resources 2 10035 2020-06-20 19:16:01.621
!MESSAGE The workspace exited with unsaved changes in the previous session; refreshing workspace to recover changes.
This is Ultimate 0.1.24-16d85fa
[2020-06-20 19:16:02,000 INFO  L170        SettingsManager]: Resetting all preferences to default values...
[2020-06-20 19:16:02,001 INFO  L174        SettingsManager]: Resetting UltimateCore preferences to default values
[2020-06-20 19:16:02,011 INFO  L177        SettingsManager]: Ultimate Commandline Interface provides no preferences, ignoring...
[2020-06-20 19:16:02,011 INFO  L174        SettingsManager]: Resetting Boogie Preprocessor preferences to default values
[2020-06-20 19:16:02,011 INFO  L174        SettingsManager]: Resetting Boogie Procedure Inliner preferences to default values
[2020-06-20 19:16:02,012 INFO  L174        SettingsManager]: Resetting Abstract Interpretation preferences to default values
[2020-06-20 19:16:02,013 INFO  L174        SettingsManager]: Resetting LassoRanker preferences to default values
[2020-06-20 19:16:02,014 INFO  L174        SettingsManager]: Resetting Reaching Definitions preferences to default values
[2020-06-20 19:16:02,015 INFO  L174        SettingsManager]: Resetting SyntaxChecker preferences to default values
[2020-06-20 19:16:02,015 INFO  L177        SettingsManager]: Büchi Program Product provides no preferences, ignoring...
[2020-06-20 19:16:02,015 INFO  L174        SettingsManager]: Resetting LTL2Aut preferences to default values
[2020-06-20 19:16:02,016 INFO  L174        SettingsManager]: Resetting PEA to Boogie preferences to default values
[2020-06-20 19:16:02,016 INFO  L174        SettingsManager]: Resetting BlockEncodingV2 preferences to default values
[2020-06-20 19:16:02,017 INFO  L174        SettingsManager]: Resetting ChcToBoogie preferences to default values
[2020-06-20 19:16:02,017 INFO  L174        SettingsManager]: Resetting AutomataScriptInterpreter preferences to default values
[2020-06-20 19:16:02,018 INFO  L174        SettingsManager]: Resetting BuchiAutomizer preferences to default values
[2020-06-20 19:16:02,019 INFO  L174        SettingsManager]: Resetting CACSL2BoogieTranslator preferences to default values
[2020-06-20 19:16:02,020 INFO  L174        SettingsManager]: Resetting CodeCheck preferences to default values
[2020-06-20 19:16:02,021 INFO  L174        SettingsManager]: Resetting InvariantSynthesis preferences to default values
[2020-06-20 19:16:02,022 INFO  L174        SettingsManager]: Resetting RCFGBuilder preferences to default values
[2020-06-20 19:16:02,022 INFO  L174        SettingsManager]: Resetting TraceAbstraction preferences to default values
[2020-06-20 19:16:02,024 INFO  L177        SettingsManager]: TraceAbstractionConcurrent provides no preferences, ignoring...
[2020-06-20 19:16:02,024 INFO  L177        SettingsManager]: TraceAbstractionWithAFAs provides no preferences, ignoring...
[2020-06-20 19:16:02,024 INFO  L174        SettingsManager]: Resetting TreeAutomizer preferences to default values
[2020-06-20 19:16:02,025 INFO  L174        SettingsManager]: Resetting IcfgTransformer preferences to default values
[2020-06-20 19:16:02,025 INFO  L174        SettingsManager]: Resetting Boogie Printer preferences to default values
[2020-06-20 19:16:02,026 INFO  L174        SettingsManager]: Resetting ReqPrinter preferences to default values
[2020-06-20 19:16:02,026 INFO  L174        SettingsManager]: Resetting Witness Printer preferences to default values
[2020-06-20 19:16:02,027 INFO  L177        SettingsManager]: Boogie PL CUP Parser provides no preferences, ignoring...
[2020-06-20 19:16:02,027 INFO  L174        SettingsManager]: Resetting CDTParser preferences to default values
[2020-06-20 19:16:02,027 INFO  L177        SettingsManager]: AutomataScriptParser provides no preferences, ignoring...
[2020-06-20 19:16:02,027 INFO  L177        SettingsManager]: ReqParser provides no preferences, ignoring...
[2020-06-20 19:16:02,028 INFO  L174        SettingsManager]: Resetting SmtParser preferences to default values
[2020-06-20 19:16:02,028 INFO  L174        SettingsManager]: Resetting Witness Parser preferences to default values
[2020-06-20 19:16:02,028 INFO  L181        SettingsManager]: Finished resetting all preferences to default values...
[2020-06-20 19:16:02,043 INFO  L81    nceAwareModelManager]: Repository-Root is: /tmp
[2020-06-20 19:16:02,051 INFO  L258   ainManager$Toolchain]: [Toolchain 1]: Applicable parser(s) successfully (re)initialized
[2020-06-20 19:16:02,053 INFO  L214   ainManager$Toolchain]: [Toolchain 1]: Toolchain selected.
[2020-06-20 19:16:02,054 INFO  L271        PluginConnector]: Initializing Boogie PL CUP Parser...
[2020-06-20 19:16:02,054 INFO  L276        PluginConnector]: Boogie PL CUP Parser initialized
[2020-06-20 19:16:02,054 INFO  L418   ainManager$Toolchain]: [Toolchain 1]: Parsing single file: /home/lixie/LassoRankerExp/LassoRankerExp/./C_Boogie/Overflow_false-no-overflow_true-termination.bpl
[2020-06-20 19:16:02,055 INFO  L111           BoogieParser]: Parsing: '/home/lixie/LassoRankerExp/LassoRankerExp/./C_Boogie/Overflow_false-no-overflow_true-termination.bpl'
[2020-06-20 19:16:02,073 INFO  L296   ainManager$Toolchain]: ####################### [Toolchain 1] #######################
[2020-06-20 19:16:02,080 INFO  L131        ToolchainWalker]: Walking toolchain with 3 elements.
[2020-06-20 19:16:02,080 INFO  L113        PluginConnector]: ------------------------Boogie Preprocessor----------------------------
[2020-06-20 19:16:02,080 INFO  L271        PluginConnector]: Initializing Boogie Preprocessor...
[2020-06-20 19:16:02,081 INFO  L276        PluginConnector]: Boogie Preprocessor initialized
[2020-06-20 19:16:02,094 INFO  L185        PluginConnector]: Executing the observer EnsureBoogieModelObserver from plugin Boogie Preprocessor for "Overflow_false-no-overflow_true-termination.bpl de.uni_freiburg.informatik.ultimate.boogie.parser AST 20.06 07:16:02" (1/1) ...
[2020-06-20 19:16:02,095 INFO  L185        PluginConnector]: Executing the observer TypeChecker from plugin Boogie Preprocessor for "Overflow_false-no-overflow_true-termination.bpl de.uni_freiburg.informatik.ultimate.boogie.parser AST 20.06 07:16:02" (1/1) ...
[2020-06-20 19:16:02,099 INFO  L185        PluginConnector]: Executing the observer ConstExpander from plugin Boogie Preprocessor for "Overflow_false-no-overflow_true-termination.bpl de.uni_freiburg.informatik.ultimate.boogie.parser AST 20.06 07:16:02" (1/1) ...
[2020-06-20 19:16:02,099 INFO  L185        PluginConnector]: Executing the observer StructExpander from plugin Boogie Preprocessor for "Overflow_false-no-overflow_true-termination.bpl de.uni_freiburg.informatik.ultimate.boogie.parser AST 20.06 07:16:02" (1/1) ...
[2020-06-20 19:16:02,101 INFO  L185        PluginConnector]: Executing the observer UnstructureCode from plugin Boogie Preprocessor for "Overflow_false-no-overflow_true-termination.bpl de.uni_freiburg.informatik.ultimate.boogie.parser AST 20.06 07:16:02" (1/1) ...
[2020-06-20 19:16:02,103 INFO  L185        PluginConnector]: Executing the observer FunctionInliner from plugin Boogie Preprocessor for "Overflow_false-no-overflow_true-termination.bpl de.uni_freiburg.informatik.ultimate.boogie.parser AST 20.06 07:16:02" (1/1) ...
[2020-06-20 19:16:02,103 INFO  L185        PluginConnector]: Executing the observer BoogieSymbolTableConstructor from plugin Boogie Preprocessor for "Overflow_false-no-overflow_true-termination.bpl de.uni_freiburg.informatik.ultimate.boogie.parser AST 20.06 07:16:02" (1/1) ...
[2020-06-20 19:16:02,104 INFO  L132        PluginConnector]: ------------------------ END Boogie Preprocessor----------------------------
[2020-06-20 19:16:02,104 INFO  L113        PluginConnector]: ------------------------RCFGBuilder----------------------------
[2020-06-20 19:16:02,105 INFO  L271        PluginConnector]: Initializing RCFGBuilder...
[2020-06-20 19:16:02,105 INFO  L276        PluginConnector]: RCFGBuilder initialized
[2020-06-20 19:16:02,105 INFO  L185        PluginConnector]: Executing the observer RCFGBuilderObserver from plugin RCFGBuilder for "Overflow_false-no-overflow_true-termination.bpl de.uni_freiburg.informatik.ultimate.boogie.parser AST 20.06 07:16:02" (1/1) ...
No working directory specified, using /home/lixie/LassoRankerExp/LassoRankerExp/z3
Starting monitored process 1 with z3 SMTLIB2_COMPLIANT=true -memory:1024 -smt2 -in -t:12000 (exit command is (exit), workingDir is null)
Waiting until toolchain timeout for monitored process 1 with z3 SMTLIB2_COMPLIANT=true -memory:1024 -smt2 -in -t:12000
[2020-06-20 19:16:02,147 INFO  L124     BoogieDeclarations]: Specification and implementation of procedure main given in one single declaration
[2020-06-20 19:16:02,147 INFO  L130     BoogieDeclarations]: Found specification of procedure main
[2020-06-20 19:16:02,147 INFO  L138     BoogieDeclarations]: Found implementation of procedure main
[2020-06-20 19:16:02,212 INFO  L278             CfgBuilder]: Using library mode
[2020-06-20 19:16:02,212 INFO  L286             CfgBuilder]: Removed 0 assue(true) statements.
[2020-06-20 19:16:02,213 INFO  L202        PluginConnector]: Adding new model Overflow_false-no-overflow_true-termination.bpl de.uni_freiburg.informatik.ultimate.plugins.generator.rcfgbuilder CFG 20.06 07:16:02 BoogieIcfgContainer
[2020-06-20 19:16:02,213 INFO  L132        PluginConnector]: ------------------------ END RCFGBuilder----------------------------
[2020-06-20 19:16:02,214 INFO  L113        PluginConnector]: ------------------------LassoRanker----------------------------
[2020-06-20 19:16:02,214 INFO  L271        PluginConnector]: Initializing LassoRanker...
[2020-06-20 19:16:02,214 INFO  L276        PluginConnector]: LassoRanker initialized
[2020-06-20 19:16:02,214 INFO  L185        PluginConnector]: Executing the observer LassoRankerObserver from plugin LassoRanker for "Overflow_false-no-overflow_true-termination.bpl de.uni_freiburg.informatik.ultimate.plugins.generator.rcfgbuilder CFG 20.06 07:16:02" (1/1) ...
[2020-06-20 19:16:02,234 INFO  L72            BuchiIsEmpty]: Start buchiIsEmpty. Operand 2 states.
[2020-06-20 19:16:02,247 INFO  L131   ngComponentsAnalysis]: Automaton has 1 accepting balls. 1
[2020-06-20 19:16:02,247 INFO  L87            BuchiIsEmpty]: Finished buchiIsEmpty Result is false
[2020-06-20 19:16:02,248 INFO  L119           BuchiIsEmpty]: Starting construction of run
[2020-06-20 19:16:02,252 INFO  L104     BuchiDifferenceFKV]: Start buchiDifferenceFKV. First operand 2 states. Second operand 1 states.
[2020-06-20 19:16:02,260 INFO  L108     BuchiDifferenceFKV]: Finished buchiDifferenceFKV. First operand 2 states. Second operand 1 states. Result 3 states and 4 transitions. Complement of second has 2 states 2 powerset states0 rank states. The highest rank that occured is -1
[2020-06-20 19:16:02,260 INFO  L72            BuchiIsEmpty]: Start buchiIsEmpty. Operand 3 states and 4 transitions.
[2020-06-20 19:16:02,260 INFO  L131   ngComponentsAnalysis]: Automaton has 0 accepting balls. 0
[2020-06-20 19:16:02,260 INFO  L87            BuchiIsEmpty]: Finished buchiIsEmpty Result is true
[2020-06-20 19:16:02,282 INFO  L216          LassoAnalysis]: Preferences:
[2020-06-20 19:16:02,283 INFO  L124   ssoRankerPreferences]: Compute integeral hull: false
[2020-06-20 19:16:02,283 INFO  L125   ssoRankerPreferences]: Enable LassoPartitioneer: true
[2020-06-20 19:16:02,283 INFO  L126   ssoRankerPreferences]: Term annotations enabled: false
[2020-06-20 19:16:02,283 INFO  L127   ssoRankerPreferences]: Use exernal solver: true
[2020-06-20 19:16:02,283 INFO  L128   ssoRankerPreferences]: SMT solver command: z3 -smt2 -in SMTLIB2_COMPLIANT=true
[2020-06-20 19:16:02,283 INFO  L129   ssoRankerPreferences]: Dump SMT script to file: false
[2020-06-20 19:16:02,283 INFO  L130   ssoRankerPreferences]: Path of dumped script: .
[2020-06-20 19:16:02,284 INFO  L131   ssoRankerPreferences]: Filename of dumped script: LassoRankerScript
[2020-06-20 19:16:02,284 INFO  L132   ssoRankerPreferences]: MapElimAlgo: Frank
[2020-06-20 19:16:02,284 INFO  L282          LassoAnalysis]: Starting lasso preprocessing...
[2020-06-20 19:16:02,296 INFO  L141          MapEliminator]: Using MapEliminator with SimplificationTechnique=SIMPLIFY_DDA XnfConversionTechnique=BOTTOM_UP_WITH_LOCAL_SIMPLIFICATION AddInequalities=false OnlyTrivialImplicationsArrayWrite=false OnlyTrivialImplicationsForModifiedArguments=true OnlyArgumentsInFormula=true
[2020-06-20 19:16:02,337 INFO  L300          LassoAnalysis]: Preprocessing complete.
[2020-06-20 19:16:02,338 INFO  L412          LassoAnalysis]: Checking for nontermination...
No working directory specified, using /home/lixie/LassoRankerExp/LassoRankerExp/z3
Starting monitored process 2 with z3 -smt2 -in SMTLIB2_COMPLIANT=true (exit command is (exit), workingDir is null)
Waiting until toolchain timeout for monitored process 2 with z3 -smt2 -in SMTLIB2_COMPLIANT=true
[2020-06-20 19:16:02,341 INFO  L151   nArgumentSynthesizer]: Nontermination analysis: LINEAR_WITH_GUESSES Allow bounded executions: true Number of generalized eigenvectors: 0 Nilpotent components: true
[2020-06-20 19:16:02,341 INFO  L163   nArgumentSynthesizer]: Using integer mode.
No working directory specified, using /home/lixie/LassoRankerExp/LassoRankerExp/z3
Starting monitored process 3 with z3 -smt2 -in SMTLIB2_COMPLIANT=true (exit command is (exit), workingDir is null)
Waiting until toolchain timeout for monitored process 3 with z3 -smt2 -in SMTLIB2_COMPLIANT=true
[2020-06-20 19:16:02,359 INFO  L151   nArgumentSynthesizer]: Nontermination analysis: LINEAR_WITH_GUESSES Allow bounded executions: true Number of generalized eigenvectors: 3 Nilpotent components: true
[2020-06-20 19:16:02,359 INFO  L163   nArgumentSynthesizer]: Using integer mode.
[2020-06-20 19:16:02,379 INFO  L452          LassoAnalysis]: Proving nontermination failed: No geometric nontermination argument exists.
[2020-06-20 19:16:02,380 INFO  L216          LassoAnalysis]: Preferences:
[2020-06-20 19:16:02,381 INFO  L124   ssoRankerPreferences]: Compute integeral hull: false
[2020-06-20 19:16:02,381 INFO  L125   ssoRankerPreferences]: Enable LassoPartitioneer: true
[2020-06-20 19:16:02,381 INFO  L126   ssoRankerPreferences]: Term annotations enabled: false
[2020-06-20 19:16:02,381 INFO  L127   ssoRankerPreferences]: Use exernal solver: true
[2020-06-20 19:16:02,381 INFO  L128   ssoRankerPreferences]: SMT solver command: z3 -smt2 -in SMTLIB2_COMPLIANT=true
[2020-06-20 19:16:02,381 INFO  L129   ssoRankerPreferences]: Dump SMT script to file: false
[2020-06-20 19:16:02,381 INFO  L130   ssoRankerPreferences]: Path of dumped script: .
[2020-06-20 19:16:02,381 INFO  L131   ssoRankerPreferences]: Filename of dumped script: LassoRankerScript
[2020-06-20 19:16:02,381 INFO  L132   ssoRankerPreferences]: MapElimAlgo: Frank
[2020-06-20 19:16:02,381 INFO  L282          LassoAnalysis]: Starting lasso preprocessing...
[2020-06-20 19:16:02,382 INFO  L141          MapEliminator]: Using MapEliminator with SimplificationTechnique=SIMPLIFY_DDA XnfConversionTechnique=BOTTOM_UP_WITH_LOCAL_SIMPLIFICATION AddInequalities=false OnlyTrivialImplicationsArrayWrite=false OnlyTrivialImplicationsForModifiedArguments=true OnlyArgumentsInFormula=true
[2020-06-20 19:16:02,402 INFO  L300          LassoAnalysis]: Preprocessing complete.
[2020-06-20 19:16:02,405 INFO  L497          LassoAnalysis]: Using template 'affine'.
No working directory specified, using /home/lixie/LassoRankerExp/LassoRankerExp/z3
Starting monitored process 4 with z3 -smt2 -in SMTLIB2_COMPLIANT=true (exit command is (exit), workingDir is null)
Waiting until toolchain timeout for monitored process 4 with z3 -smt2 -in SMTLIB2_COMPLIANT=true
[2020-06-20 19:16:02,411 INFO  L122   nArgumentSynthesizer]: Termination Analysis Settings:
Termination analysis: LINEAR_WITH_GUESSES
Number of strict supporting invariants: 1
Number of non-strict supporting invariants: 0
Consider only non-deceasing supporting invariants: true
Simplify termination arguments: true
Simplify supporting invariants: trueOverapproximate stem: false
[2020-06-20 19:16:02,413 INFO  L339   nArgumentSynthesizer]: Template has degree 0.
[2020-06-20 19:16:02,413 INFO  L352   nArgumentSynthesizer]: There is no stem transition; disabling supporting invariant generation.
[2020-06-20 19:16:02,414 INFO  L205   nArgumentSynthesizer]: 1 stem disjuncts
[2020-06-20 19:16:02,414 INFO  L206   nArgumentSynthesizer]: 1 loop disjuncts
[2020-06-20 19:16:02,414 INFO  L207   nArgumentSynthesizer]: 2 template conjuncts.
[2020-06-20 19:16:02,417 INFO  L402   nArgumentSynthesizer]: We have 2 Motzkin's Theorem applications.
[2020-06-20 19:16:02,417 INFO  L403   nArgumentSynthesizer]: A total of 0 supporting invariants were added.
[2020-06-20 19:16:02,418 INFO  L421   nArgumentSynthesizer]: Found a termination argument, trying to simplify.
[2020-06-20 19:16:02,423 INFO  L443   ModelExtractionUtils]: Simplification made 3 calls to the SMT solver.
[2020-06-20 19:16:02,423 INFO  L444   ModelExtractionUtils]: 0 out of 3 variables were initially zero. Simplification set additionally 0 variables to zero.
No working directory specified, using /home/lixie/LassoRankerExp/LassoRankerExp/z3
Starting monitored process 5 with z3 -smt2 -in SMTLIB2_COMPLIANT=true (exit command is (exit), workingDir is null)
Waiting until toolchain timeout for monitored process 5 with z3 -smt2 -in SMTLIB2_COMPLIANT=true
[2020-06-20 19:16:02,426 INFO  L437   nArgumentSynthesizer]: Simplifying supporting invariants...
[2020-06-20 19:16:02,426 INFO  L440   nArgumentSynthesizer]: Removed 0 redundant supporting invariants from a total of 0.
[2020-06-20 19:16:02,427 INFO  L518          LassoAnalysis]: Proved termination.
[2020-06-20 19:16:02,427 INFO  L520          LassoAnalysis]: Termination argument consisting of:
Ranking function f(main_i) = -2*main_i + 4294967295
Supporting invariants []
[2020-06-20 19:16:02,444 INFO  L132        PluginConnector]: ------------------------ END LassoRanker----------------------------
[2020-06-20 19:16:02,445 INFO  L168              Benchmark]: Toolchain (without parser) took 371.48 ms. Allocated memory is still 514.9 MB. Free memory was 471.4 MB in the beginning and 427.5 MB in the end (delta: 44.0 MB). Peak memory consumption was 44.0 MB. Max. memory is 11.5 GB.
[2020-06-20 19:16:02,446 INFO  L168              Benchmark]: Boogie PL CUP Parser took 0.12 ms. Allocated memory is still 514.9 MB. Free memory is still 472.9 MB. There was no memory consumed. Max. memory is 11.5 GB.
[2020-06-20 19:16:02,446 INFO  L168              Benchmark]: Boogie Preprocessor took 23.80 ms. Allocated memory is still 514.9 MB. Free memory was 470.1 MB in the beginning and 468.7 MB in the end (delta: 1.3 MB). Peak memory consumption was 1.3 MB. Max. memory is 11.5 GB.
[2020-06-20 19:16:02,447 INFO  L168              Benchmark]: RCFGBuilder took 108.94 ms. Allocated memory is still 514.9 MB. Free memory was 468.7 MB in the beginning and 459.2 MB in the end (delta: 9.5 MB). Peak memory consumption was 9.5 MB. Max. memory is 11.5 GB.
[2020-06-20 19:16:02,447 INFO  L168              Benchmark]: LassoRanker took 230.72 ms. Allocated memory is still 514.9 MB. Free memory was 459.2 MB in the beginning and 427.5 MB in the end (delta: 31.7 MB). Peak memory consumption was 31.7 MB. Max. memory is 11.5 GB.
[2020-06-20 19:16:02,449 INFO  L336   ainManager$Toolchain]: #######################  End [Toolchain 1] #######################
 --- Results ---
 * Results from de.uni_freiburg.informatik.ultimate.core:
  - StatisticsResult: Toolchain Benchmarks
    Benchmark results are:
 * Boogie PL CUP Parser took 0.12 ms. Allocated memory is still 514.9 MB. Free memory is still 472.9 MB. There was no memory consumed. Max. memory is 11.5 GB.
 * Boogie Preprocessor took 23.80 ms. Allocated memory is still 514.9 MB. Free memory was 470.1 MB in the beginning and 468.7 MB in the end (delta: 1.3 MB). Peak memory consumption was 1.3 MB. Max. memory is 11.5 GB.
 * RCFGBuilder took 108.94 ms. Allocated memory is still 514.9 MB. Free memory was 468.7 MB in the beginning and 459.2 MB in the end (delta: 9.5 MB). Peak memory consumption was 9.5 MB. Max. memory is 11.5 GB.
 * LassoRanker took 230.72 ms. Allocated memory is still 514.9 MB. Free memory was 459.2 MB in the beginning and 427.5 MB in the end (delta: 31.7 MB). Peak memory consumption was 31.7 MB. Max. memory is 11.5 GB.
 * Results from de.uni_freiburg.informatik.ultimate.plugins.analysis.lassoranker:
  - TerminationArgumentResult [Line: 1]: Found affine ranking function
    Found a termination argument consisting of the affine ranking function: [-2 * i + 4294967295] for which no supporting invariant is required.
RESULT: Ultimate proved your program to be correct!
Received shutdown request...
Ultimate:
GTK+ Version Check
