!SESSION 2020-06-20 19:16:40.089 -----------------------------------------------
eclipse.buildId=unknown
java.version=1.8.0_181
java.vendor=Oracle Corporation
BootLoader constants: OS=linux, ARCH=x86_64, WS=gtk, NL=en_US
Framework arguments:  --console -tc config/LassoRankerBoogie.xml -i ./C_Boogie//Sunset.bpl
Command-line arguments:  -os linux -ws gtk -arch x86_64 -consoleLog --console -data @user.home/.ultimate -tc config/LassoRankerBoogie.xml -i ./C_Boogie//Sunset.bpl

!ENTRY org.eclipse.core.resources 2 10035 2020-06-20 19:16:40.632
!MESSAGE The workspace exited with unsaved changes in the previous session; refreshing workspace to recover changes.
This is Ultimate 0.1.24-16d85fa
[2020-06-20 19:16:41,014 INFO  L170        SettingsManager]: Resetting all preferences to default values...
[2020-06-20 19:16:41,016 INFO  L174        SettingsManager]: Resetting UltimateCore preferences to default values
[2020-06-20 19:16:41,027 INFO  L177        SettingsManager]: Ultimate Commandline Interface provides no preferences, ignoring...
[2020-06-20 19:16:41,027 INFO  L174        SettingsManager]: Resetting Boogie Preprocessor preferences to default values
[2020-06-20 19:16:41,027 INFO  L174        SettingsManager]: Resetting Boogie Procedure Inliner preferences to default values
[2020-06-20 19:16:41,028 INFO  L174        SettingsManager]: Resetting Abstract Interpretation preferences to default values
[2020-06-20 19:16:41,029 INFO  L174        SettingsManager]: Resetting LassoRanker preferences to default values
[2020-06-20 19:16:41,031 INFO  L174        SettingsManager]: Resetting Reaching Definitions preferences to default values
[2020-06-20 19:16:41,031 INFO  L174        SettingsManager]: Resetting SyntaxChecker preferences to default values
[2020-06-20 19:16:41,032 INFO  L177        SettingsManager]: Büchi Program Product provides no preferences, ignoring...
[2020-06-20 19:16:41,032 INFO  L174        SettingsManager]: Resetting LTL2Aut preferences to default values
[2020-06-20 19:16:41,033 INFO  L174        SettingsManager]: Resetting PEA to Boogie preferences to default values
[2020-06-20 19:16:41,034 INFO  L174        SettingsManager]: Resetting BlockEncodingV2 preferences to default values
[2020-06-20 19:16:41,035 INFO  L174        SettingsManager]: Resetting ChcToBoogie preferences to default values
[2020-06-20 19:16:41,035 INFO  L174        SettingsManager]: Resetting AutomataScriptInterpreter preferences to default values
[2020-06-20 19:16:41,036 INFO  L174        SettingsManager]: Resetting BuchiAutomizer preferences to default values
[2020-06-20 19:16:41,038 INFO  L174        SettingsManager]: Resetting CACSL2BoogieTranslator preferences to default values
[2020-06-20 19:16:41,039 INFO  L174        SettingsManager]: Resetting CodeCheck preferences to default values
[2020-06-20 19:16:41,041 INFO  L174        SettingsManager]: Resetting InvariantSynthesis preferences to default values
[2020-06-20 19:16:41,042 INFO  L174        SettingsManager]: Resetting RCFGBuilder preferences to default values
[2020-06-20 19:16:41,043 INFO  L174        SettingsManager]: Resetting TraceAbstraction preferences to default values
[2020-06-20 19:16:41,045 INFO  L177        SettingsManager]: TraceAbstractionConcurrent provides no preferences, ignoring...
[2020-06-20 19:16:41,045 INFO  L177        SettingsManager]: TraceAbstractionWithAFAs provides no preferences, ignoring...
[2020-06-20 19:16:41,045 INFO  L174        SettingsManager]: Resetting TreeAutomizer preferences to default values
[2020-06-20 19:16:41,046 INFO  L174        SettingsManager]: Resetting IcfgTransformer preferences to default values
[2020-06-20 19:16:41,047 INFO  L174        SettingsManager]: Resetting Boogie Printer preferences to default values
[2020-06-20 19:16:41,047 INFO  L174        SettingsManager]: Resetting ReqPrinter preferences to default values
[2020-06-20 19:16:41,048 INFO  L174        SettingsManager]: Resetting Witness Printer preferences to default values
[2020-06-20 19:16:41,049 INFO  L177        SettingsManager]: Boogie PL CUP Parser provides no preferences, ignoring...
[2020-06-20 19:16:41,049 INFO  L174        SettingsManager]: Resetting CDTParser preferences to default values
[2020-06-20 19:16:41,049 INFO  L177        SettingsManager]: AutomataScriptParser provides no preferences, ignoring...
[2020-06-20 19:16:41,049 INFO  L177        SettingsManager]: ReqParser provides no preferences, ignoring...
[2020-06-20 19:16:41,049 INFO  L174        SettingsManager]: Resetting SmtParser preferences to default values
[2020-06-20 19:16:41,050 INFO  L174        SettingsManager]: Resetting Witness Parser preferences to default values
[2020-06-20 19:16:41,051 INFO  L181        SettingsManager]: Finished resetting all preferences to default values...
[2020-06-20 19:16:41,070 INFO  L81    nceAwareModelManager]: Repository-Root is: /tmp
[2020-06-20 19:16:41,081 INFO  L258   ainManager$Toolchain]: [Toolchain 1]: Applicable parser(s) successfully (re)initialized
[2020-06-20 19:16:41,084 INFO  L214   ainManager$Toolchain]: [Toolchain 1]: Toolchain selected.
[2020-06-20 19:16:41,085 INFO  L271        PluginConnector]: Initializing Boogie PL CUP Parser...
[2020-06-20 19:16:41,086 INFO  L276        PluginConnector]: Boogie PL CUP Parser initialized
[2020-06-20 19:16:41,087 INFO  L418   ainManager$Toolchain]: [Toolchain 1]: Parsing single file: /home/lixie/LassoRankerExp/LassoRankerExp/./C_Boogie/Sunset.bpl
[2020-06-20 19:16:41,087 INFO  L111           BoogieParser]: Parsing: '/home/lixie/LassoRankerExp/LassoRankerExp/./C_Boogie/Sunset.bpl'
[2020-06-20 19:16:41,114 INFO  L296   ainManager$Toolchain]: ####################### [Toolchain 1] #######################
[2020-06-20 19:16:41,123 INFO  L131        ToolchainWalker]: Walking toolchain with 3 elements.
[2020-06-20 19:16:41,124 INFO  L113        PluginConnector]: ------------------------Boogie Preprocessor----------------------------
[2020-06-20 19:16:41,124 INFO  L271        PluginConnector]: Initializing Boogie Preprocessor...
[2020-06-20 19:16:41,124 INFO  L276        PluginConnector]: Boogie Preprocessor initialized
[2020-06-20 19:16:41,138 INFO  L185        PluginConnector]: Executing the observer EnsureBoogieModelObserver from plugin Boogie Preprocessor for "Sunset.bpl de.uni_freiburg.informatik.ultimate.boogie.parser AST 20.06 07:16:41" (1/1) ...
[2020-06-20 19:16:41,139 INFO  L185        PluginConnector]: Executing the observer TypeChecker from plugin Boogie Preprocessor for "Sunset.bpl de.uni_freiburg.informatik.ultimate.boogie.parser AST 20.06 07:16:41" (1/1) ...
[2020-06-20 19:16:41,142 INFO  L185        PluginConnector]: Executing the observer ConstExpander from plugin Boogie Preprocessor for "Sunset.bpl de.uni_freiburg.informatik.ultimate.boogie.parser AST 20.06 07:16:41" (1/1) ...
[2020-06-20 19:16:41,143 INFO  L185        PluginConnector]: Executing the observer StructExpander from plugin Boogie Preprocessor for "Sunset.bpl de.uni_freiburg.informatik.ultimate.boogie.parser AST 20.06 07:16:41" (1/1) ...
[2020-06-20 19:16:41,144 INFO  L185        PluginConnector]: Executing the observer UnstructureCode from plugin Boogie Preprocessor for "Sunset.bpl de.uni_freiburg.informatik.ultimate.boogie.parser AST 20.06 07:16:41" (1/1) ...
[2020-06-20 19:16:41,147 INFO  L185        PluginConnector]: Executing the observer FunctionInliner from plugin Boogie Preprocessor for "Sunset.bpl de.uni_freiburg.informatik.ultimate.boogie.parser AST 20.06 07:16:41" (1/1) ...
[2020-06-20 19:16:41,148 INFO  L185        PluginConnector]: Executing the observer BoogieSymbolTableConstructor from plugin Boogie Preprocessor for "Sunset.bpl de.uni_freiburg.informatik.ultimate.boogie.parser AST 20.06 07:16:41" (1/1) ...
[2020-06-20 19:16:41,149 INFO  L132        PluginConnector]: ------------------------ END Boogie Preprocessor----------------------------
[2020-06-20 19:16:41,149 INFO  L113        PluginConnector]: ------------------------RCFGBuilder----------------------------
[2020-06-20 19:16:41,149 INFO  L271        PluginConnector]: Initializing RCFGBuilder...
[2020-06-20 19:16:41,149 INFO  L276        PluginConnector]: RCFGBuilder initialized
[2020-06-20 19:16:41,150 INFO  L185        PluginConnector]: Executing the observer RCFGBuilderObserver from plugin RCFGBuilder for "Sunset.bpl de.uni_freiburg.informatik.ultimate.boogie.parser AST 20.06 07:16:41" (1/1) ...
No working directory specified, using /home/lixie/LassoRankerExp/LassoRankerExp/z3
Starting monitored process 1 with z3 SMTLIB2_COMPLIANT=true -memory:1024 -smt2 -in -t:12000 (exit command is (exit), workingDir is null)
Waiting until toolchain timeout for monitored process 1 with z3 SMTLIB2_COMPLIANT=true -memory:1024 -smt2 -in -t:12000
[2020-06-20 19:16:41,187 INFO  L124     BoogieDeclarations]: Specification and implementation of procedure main given in one single declaration
[2020-06-20 19:16:41,187 INFO  L130     BoogieDeclarations]: Found specification of procedure main
[2020-06-20 19:16:41,187 INFO  L138     BoogieDeclarations]: Found implementation of procedure main
[2020-06-20 19:16:41,279 INFO  L278             CfgBuilder]: Using library mode
[2020-06-20 19:16:41,279 INFO  L286             CfgBuilder]: Removed 0 assue(true) statements.
[2020-06-20 19:16:41,280 INFO  L202        PluginConnector]: Adding new model Sunset.bpl de.uni_freiburg.informatik.ultimate.plugins.generator.rcfgbuilder CFG 20.06 07:16:41 BoogieIcfgContainer
[2020-06-20 19:16:41,280 INFO  L132        PluginConnector]: ------------------------ END RCFGBuilder----------------------------
[2020-06-20 19:16:41,280 INFO  L113        PluginConnector]: ------------------------LassoRanker----------------------------
[2020-06-20 19:16:41,280 INFO  L271        PluginConnector]: Initializing LassoRanker...
[2020-06-20 19:16:41,280 INFO  L276        PluginConnector]: LassoRanker initialized
[2020-06-20 19:16:41,281 INFO  L185        PluginConnector]: Executing the observer LassoRankerObserver from plugin LassoRanker for "Sunset.bpl de.uni_freiburg.informatik.ultimate.plugins.generator.rcfgbuilder CFG 20.06 07:16:41" (1/1) ...
[2020-06-20 19:16:41,298 INFO  L72            BuchiIsEmpty]: Start buchiIsEmpty. Operand 2 states.
[2020-06-20 19:16:41,313 INFO  L131   ngComponentsAnalysis]: Automaton has 1 accepting balls. 1
[2020-06-20 19:16:41,313 INFO  L87            BuchiIsEmpty]: Finished buchiIsEmpty Result is false
[2020-06-20 19:16:41,313 INFO  L119           BuchiIsEmpty]: Starting construction of run
[2020-06-20 19:16:41,318 INFO  L104     BuchiDifferenceFKV]: Start buchiDifferenceFKV. First operand 2 states. Second operand 1 states.
[2020-06-20 19:16:41,326 INFO  L108     BuchiDifferenceFKV]: Finished buchiDifferenceFKV. First operand 2 states. Second operand 1 states. Result 3 states and 4 transitions. Complement of second has 2 states 2 powerset states0 rank states. The highest rank that occured is -1
[2020-06-20 19:16:41,327 INFO  L72            BuchiIsEmpty]: Start buchiIsEmpty. Operand 3 states and 4 transitions.
[2020-06-20 19:16:41,327 INFO  L131   ngComponentsAnalysis]: Automaton has 0 accepting balls. 0
[2020-06-20 19:16:41,327 INFO  L87            BuchiIsEmpty]: Finished buchiIsEmpty Result is true
[2020-06-20 19:16:41,418 INFO  L216          LassoAnalysis]: Preferences:
[2020-06-20 19:16:41,419 INFO  L124   ssoRankerPreferences]: Compute integeral hull: false
[2020-06-20 19:16:41,419 INFO  L125   ssoRankerPreferences]: Enable LassoPartitioneer: true
[2020-06-20 19:16:41,420 INFO  L126   ssoRankerPreferences]: Term annotations enabled: false
[2020-06-20 19:16:41,420 INFO  L127   ssoRankerPreferences]: Use exernal solver: true
[2020-06-20 19:16:41,420 INFO  L128   ssoRankerPreferences]: SMT solver command: z3 -smt2 -in SMTLIB2_COMPLIANT=true
[2020-06-20 19:16:41,420 INFO  L129   ssoRankerPreferences]: Dump SMT script to file: false
[2020-06-20 19:16:41,420 INFO  L130   ssoRankerPreferences]: Path of dumped script: .
[2020-06-20 19:16:41,420 INFO  L131   ssoRankerPreferences]: Filename of dumped script: LassoRankerScript
[2020-06-20 19:16:41,420 INFO  L132   ssoRankerPreferences]: MapElimAlgo: Frank
[2020-06-20 19:16:41,420 INFO  L282          LassoAnalysis]: Starting lasso preprocessing...
[2020-06-20 19:16:41,434 INFO  L141          MapEliminator]: Using MapEliminator with SimplificationTechnique=SIMPLIFY_DDA XnfConversionTechnique=BOTTOM_UP_WITH_LOCAL_SIMPLIFICATION AddInequalities=false OnlyTrivialImplicationsArrayWrite=false OnlyTrivialImplicationsForModifiedArguments=true OnlyArgumentsInFormula=true
[2020-06-20 19:16:41,611 INFO  L300          LassoAnalysis]: Preprocessing complete.
[2020-06-20 19:16:41,611 INFO  L412          LassoAnalysis]: Checking for nontermination...
No working directory specified, using /home/lixie/LassoRankerExp/LassoRankerExp/z3
Starting monitored process 2 with z3 -smt2 -in SMTLIB2_COMPLIANT=true (exit command is (exit), workingDir is null)
Waiting until toolchain timeout for monitored process 2 with z3 -smt2 -in SMTLIB2_COMPLIANT=true
[2020-06-20 19:16:41,615 INFO  L151   nArgumentSynthesizer]: Nontermination analysis: LINEAR_WITH_GUESSES Allow bounded executions: true Number of generalized eigenvectors: 0 Nilpotent components: true
[2020-06-20 19:16:41,615 INFO  L163   nArgumentSynthesizer]: Using integer mode.
No working directory specified, using /home/lixie/LassoRankerExp/LassoRankerExp/z3
Starting monitored process 3 with z3 -smt2 -in SMTLIB2_COMPLIANT=true (exit command is (exit), workingDir is null)
Waiting until toolchain timeout for monitored process 3 with z3 -smt2 -in SMTLIB2_COMPLIANT=true
[2020-06-20 19:16:41,647 INFO  L151   nArgumentSynthesizer]: Nontermination analysis: LINEAR_WITH_GUESSES Allow bounded executions: true Number of generalized eigenvectors: 3 Nilpotent components: true
[2020-06-20 19:16:41,647 INFO  L163   nArgumentSynthesizer]: Using integer mode.
[2020-06-20 19:16:41,680 INFO  L452          LassoAnalysis]: Proving nontermination failed: No geometric nontermination argument exists.
[2020-06-20 19:16:41,682 INFO  L216          LassoAnalysis]: Preferences:
[2020-06-20 19:16:41,682 INFO  L124   ssoRankerPreferences]: Compute integeral hull: false
[2020-06-20 19:16:41,682 INFO  L125   ssoRankerPreferences]: Enable LassoPartitioneer: true
[2020-06-20 19:16:41,682 INFO  L126   ssoRankerPreferences]: Term annotations enabled: false
[2020-06-20 19:16:41,682 INFO  L127   ssoRankerPreferences]: Use exernal solver: true
[2020-06-20 19:16:41,682 INFO  L128   ssoRankerPreferences]: SMT solver command: z3 -smt2 -in SMTLIB2_COMPLIANT=true
[2020-06-20 19:16:41,682 INFO  L129   ssoRankerPreferences]: Dump SMT script to file: false
[2020-06-20 19:16:41,683 INFO  L130   ssoRankerPreferences]: Path of dumped script: .
[2020-06-20 19:16:41,683 INFO  L131   ssoRankerPreferences]: Filename of dumped script: LassoRankerScript
[2020-06-20 19:16:41,683 INFO  L132   ssoRankerPreferences]: MapElimAlgo: Frank
[2020-06-20 19:16:41,683 INFO  L282          LassoAnalysis]: Starting lasso preprocessing...
[2020-06-20 19:16:41,684 INFO  L141          MapEliminator]: Using MapEliminator with SimplificationTechnique=SIMPLIFY_DDA XnfConversionTechnique=BOTTOM_UP_WITH_LOCAL_SIMPLIFICATION AddInequalities=false OnlyTrivialImplicationsArrayWrite=false OnlyTrivialImplicationsForModifiedArguments=true OnlyArgumentsInFormula=true
[2020-06-20 19:16:41,816 INFO  L300          LassoAnalysis]: Preprocessing complete.
[2020-06-20 19:16:41,819 INFO  L497          LassoAnalysis]: Using template 'affine'.
No working directory specified, using /home/lixie/LassoRankerExp/LassoRankerExp/z3
Starting monitored process 4 with z3 -smt2 -in SMTLIB2_COMPLIANT=true (exit command is (exit), workingDir is null)
Waiting until toolchain timeout for monitored process 4 with z3 -smt2 -in SMTLIB2_COMPLIANT=true
[2020-06-20 19:16:41,828 INFO  L122   nArgumentSynthesizer]: Termination Analysis Settings:
Termination analysis: LINEAR_WITH_GUESSES
Number of strict supporting invariants: 1
Number of non-strict supporting invariants: 0
Consider only non-deceasing supporting invariants: true
Simplify termination arguments: true
Simplify supporting invariants: trueOverapproximate stem: false
[2020-06-20 19:16:41,830 INFO  L339   nArgumentSynthesizer]: Template has degree 0.
[2020-06-20 19:16:41,830 INFO  L352   nArgumentSynthesizer]: There is no stem transition; disabling supporting invariant generation.
[2020-06-20 19:16:41,831 INFO  L205   nArgumentSynthesizer]: 1 stem disjuncts
[2020-06-20 19:16:41,831 INFO  L206   nArgumentSynthesizer]: 4 loop disjuncts
[2020-06-20 19:16:41,831 INFO  L207   nArgumentSynthesizer]: 2 template conjuncts.
[2020-06-20 19:16:41,836 INFO  L402   nArgumentSynthesizer]: We have 8 Motzkin's Theorem applications.
[2020-06-20 19:16:41,836 INFO  L403   nArgumentSynthesizer]: A total of 0 supporting invariants were added.
[2020-06-20 19:16:41,839 INFO  L530          LassoAnalysis]: Proving termination failed for this template and these settings.
[2020-06-20 19:16:41,853 INFO  L497          LassoAnalysis]: Using template '2-nested'.
No working directory specified, using /home/lixie/LassoRankerExp/LassoRankerExp/z3
Starting monitored process 5 with z3 -smt2 -in SMTLIB2_COMPLIANT=true (exit command is (exit), workingDir is null)
Waiting until toolchain timeout for monitored process 5 with z3 -smt2 -in SMTLIB2_COMPLIANT=true
[2020-06-20 19:16:41,855 INFO  L122   nArgumentSynthesizer]: Termination Analysis Settings:
Termination analysis: LINEAR_WITH_GUESSES
Number of strict supporting invariants: 1
Number of non-strict supporting invariants: 0
Consider only non-deceasing supporting invariants: true
Simplify termination arguments: true
Simplify supporting invariants: trueOverapproximate stem: false
[2020-06-20 19:16:41,856 INFO  L339   nArgumentSynthesizer]: Template has degree 0.
[2020-06-20 19:16:41,856 INFO  L352   nArgumentSynthesizer]: There is no stem transition; disabling supporting invariant generation.
[2020-06-20 19:16:41,856 INFO  L205   nArgumentSynthesizer]: 1 stem disjuncts
[2020-06-20 19:16:41,856 INFO  L206   nArgumentSynthesizer]: 4 loop disjuncts
[2020-06-20 19:16:41,856 INFO  L207   nArgumentSynthesizer]: 3 template conjuncts.
[2020-06-20 19:16:41,862 INFO  L402   nArgumentSynthesizer]: We have 12 Motzkin's Theorem applications.
[2020-06-20 19:16:41,862 INFO  L403   nArgumentSynthesizer]: A total of 0 supporting invariants were added.
[2020-06-20 19:16:41,866 INFO  L530          LassoAnalysis]: Proving termination failed for this template and these settings.
[2020-06-20 19:16:41,882 INFO  L497          LassoAnalysis]: Using template '3-nested'.
No working directory specified, using /home/lixie/LassoRankerExp/LassoRankerExp/z3
Starting monitored process 6 with z3 -smt2 -in SMTLIB2_COMPLIANT=true (exit command is (exit), workingDir is null)
Waiting until toolchain timeout for monitored process 6 with z3 -smt2 -in SMTLIB2_COMPLIANT=true
[2020-06-20 19:16:41,884 INFO  L122   nArgumentSynthesizer]: Termination Analysis Settings:
Termination analysis: LINEAR_WITH_GUESSES
Number of strict supporting invariants: 1
Number of non-strict supporting invariants: 0
Consider only non-deceasing supporting invariants: true
Simplify termination arguments: true
Simplify supporting invariants: trueOverapproximate stem: false
[2020-06-20 19:16:41,885 INFO  L339   nArgumentSynthesizer]: Template has degree 0.
[2020-06-20 19:16:41,885 INFO  L352   nArgumentSynthesizer]: There is no stem transition; disabling supporting invariant generation.
[2020-06-20 19:16:41,885 INFO  L205   nArgumentSynthesizer]: 1 stem disjuncts
[2020-06-20 19:16:41,885 INFO  L206   nArgumentSynthesizer]: 4 loop disjuncts
[2020-06-20 19:16:41,885 INFO  L207   nArgumentSynthesizer]: 4 template conjuncts.
[2020-06-20 19:16:41,891 INFO  L402   nArgumentSynthesizer]: We have 16 Motzkin's Theorem applications.
[2020-06-20 19:16:41,891 INFO  L403   nArgumentSynthesizer]: A total of 0 supporting invariants were added.
[2020-06-20 19:16:41,895 INFO  L530          LassoAnalysis]: Proving termination failed for this template and these settings.
[2020-06-20 19:16:41,908 INFO  L497          LassoAnalysis]: Using template '4-nested'.
No working directory specified, using /home/lixie/LassoRankerExp/LassoRankerExp/z3
Starting monitored process 7 with z3 -smt2 -in SMTLIB2_COMPLIANT=true (exit command is (exit), workingDir is null)
Waiting until toolchain timeout for monitored process 7 with z3 -smt2 -in SMTLIB2_COMPLIANT=true
[2020-06-20 19:16:41,910 INFO  L122   nArgumentSynthesizer]: Termination Analysis Settings:
Termination analysis: LINEAR_WITH_GUESSES
Number of strict supporting invariants: 1
Number of non-strict supporting invariants: 0
Consider only non-deceasing supporting invariants: true
Simplify termination arguments: true
Simplify supporting invariants: trueOverapproximate stem: false
[2020-06-20 19:16:41,911 INFO  L339   nArgumentSynthesizer]: Template has degree 0.
[2020-06-20 19:16:41,911 INFO  L352   nArgumentSynthesizer]: There is no stem transition; disabling supporting invariant generation.
[2020-06-20 19:16:41,911 INFO  L205   nArgumentSynthesizer]: 1 stem disjuncts
[2020-06-20 19:16:41,911 INFO  L206   nArgumentSynthesizer]: 4 loop disjuncts
[2020-06-20 19:16:41,911 INFO  L207   nArgumentSynthesizer]: 5 template conjuncts.
[2020-06-20 19:16:41,917 INFO  L402   nArgumentSynthesizer]: We have 20 Motzkin's Theorem applications.
[2020-06-20 19:16:41,917 INFO  L403   nArgumentSynthesizer]: A total of 0 supporting invariants were added.
[2020-06-20 19:16:41,923 INFO  L530          LassoAnalysis]: Proving termination failed for this template and these settings.
[2020-06-20 19:16:41,946 INFO  L497          LassoAnalysis]: Using template '2-phase'.
No working directory specified, using /home/lixie/LassoRankerExp/LassoRankerExp/z3
Starting monitored process 8 with z3 -smt2 -in SMTLIB2_COMPLIANT=true (exit command is (exit), workingDir is null)
Waiting until toolchain timeout for monitored process 8 with z3 -smt2 -in SMTLIB2_COMPLIANT=true
[2020-06-20 19:16:41,947 INFO  L122   nArgumentSynthesizer]: Termination Analysis Settings:
Termination analysis: LINEAR_WITH_GUESSES
Number of strict supporting invariants: 1
Number of non-strict supporting invariants: 0
Consider only non-deceasing supporting invariants: true
Simplify termination arguments: true
Simplify supporting invariants: trueOverapproximate stem: false
[2020-06-20 19:16:41,948 WARN  L334   nArgumentSynthesizer]: Using a linear SMT query and a templates of degree > 0, hence this method is incomplete.
[2020-06-20 19:16:41,949 INFO  L339   nArgumentSynthesizer]: Template has degree 1.
[2020-06-20 19:16:41,949 INFO  L352   nArgumentSynthesizer]: There is no stem transition; disabling supporting invariant generation.
[2020-06-20 19:16:41,949 INFO  L205   nArgumentSynthesizer]: 1 stem disjuncts
[2020-06-20 19:16:41,949 INFO  L206   nArgumentSynthesizer]: 4 loop disjuncts
[2020-06-20 19:16:41,949 INFO  L207   nArgumentSynthesizer]: 3 template conjuncts.
[2020-06-20 19:16:41,953 INFO  L402   nArgumentSynthesizer]: We have 12 Motzkin's Theorem applications.
[2020-06-20 19:16:41,954 INFO  L403   nArgumentSynthesizer]: A total of 0 supporting invariants were added.
[2020-06-20 19:16:41,962 INFO  L530          LassoAnalysis]: Proving termination failed for this template and these settings.
[2020-06-20 19:16:41,974 INFO  L497          LassoAnalysis]: Using template 'lex(affine, affine)'.
No working directory specified, using /home/lixie/LassoRankerExp/LassoRankerExp/z3
Starting monitored process 9 with z3 -smt2 -in SMTLIB2_COMPLIANT=true (exit command is (exit), workingDir is null)
Waiting until toolchain timeout for monitored process 9 with z3 -smt2 -in SMTLIB2_COMPLIANT=true
[2020-06-20 19:16:41,976 INFO  L122   nArgumentSynthesizer]: Termination Analysis Settings:
Termination analysis: LINEAR_WITH_GUESSES
Number of strict supporting invariants: 1
Number of non-strict supporting invariants: 0
Consider only non-deceasing supporting invariants: true
Simplify termination arguments: true
Simplify supporting invariants: trueOverapproximate stem: false
[2020-06-20 19:16:41,977 WARN  L334   nArgumentSynthesizer]: Using a linear SMT query and a templates of degree > 0, hence this method is incomplete.
[2020-06-20 19:16:41,977 INFO  L339   nArgumentSynthesizer]: Template has degree 5.
[2020-06-20 19:16:41,977 INFO  L352   nArgumentSynthesizer]: There is no stem transition; disabling supporting invariant generation.
[2020-06-20 19:16:41,978 INFO  L205   nArgumentSynthesizer]: 1 stem disjuncts
[2020-06-20 19:16:41,978 INFO  L206   nArgumentSynthesizer]: 4 loop disjuncts
[2020-06-20 19:16:41,978 INFO  L207   nArgumentSynthesizer]: 4 template conjuncts.
[2020-06-20 19:16:41,983 INFO  L402   nArgumentSynthesizer]: We have 16 Motzkin's Theorem applications.
[2020-06-20 19:16:41,983 INFO  L403   nArgumentSynthesizer]: A total of 0 supporting invariants were added.
[2020-06-20 19:16:41,995 INFO  L530          LassoAnalysis]: Proving termination failed for this template and these settings.
[2020-06-20 19:16:42,007 INFO  L497          LassoAnalysis]: Using template '2-piece'.
No working directory specified, using /home/lixie/LassoRankerExp/LassoRankerExp/z3
Starting monitored process 10 with z3 -smt2 -in SMTLIB2_COMPLIANT=true (exit command is (exit), workingDir is null)
Waiting until toolchain timeout for monitored process 10 with z3 -smt2 -in SMTLIB2_COMPLIANT=true
[2020-06-20 19:16:42,009 INFO  L122   nArgumentSynthesizer]: Termination Analysis Settings:
Termination analysis: LINEAR_WITH_GUESSES
Number of strict supporting invariants: 1
Number of non-strict supporting invariants: 0
Consider only non-deceasing supporting invariants: true
Simplify termination arguments: true
Simplify supporting invariants: trueOverapproximate stem: false
[2020-06-20 19:16:42,010 WARN  L334   nArgumentSynthesizer]: Using a linear SMT query and a templates of degree > 0, hence this method is incomplete.
[2020-06-20 19:16:42,010 INFO  L339   nArgumentSynthesizer]: Template has degree 7.
[2020-06-20 19:16:42,010 INFO  L352   nArgumentSynthesizer]: There is no stem transition; disabling supporting invariant generation.
[2020-06-20 19:16:42,010 INFO  L205   nArgumentSynthesizer]: 1 stem disjuncts
[2020-06-20 19:16:42,010 INFO  L206   nArgumentSynthesizer]: 4 loop disjuncts
[2020-06-20 19:16:42,011 INFO  L207   nArgumentSynthesizer]: 7 template conjuncts.
[2020-06-20 19:16:42,018 INFO  L402   nArgumentSynthesizer]: We have 28 Motzkin's Theorem applications.
[2020-06-20 19:16:42,018 INFO  L403   nArgumentSynthesizer]: A total of 0 supporting invariants were added.
[2020-06-20 19:16:45,157 INFO  L530          LassoAnalysis]: Proving termination failed for this template and these settings.
[2020-06-20 19:16:45,169 INFO  L497          LassoAnalysis]: Using template '2-parallel'.
No working directory specified, using /home/lixie/LassoRankerExp/LassoRankerExp/z3
Starting monitored process 11 with z3 -smt2 -in SMTLIB2_COMPLIANT=true (exit command is (exit), workingDir is null)
Waiting until toolchain timeout for monitored process 11 with z3 -smt2 -in SMTLIB2_COMPLIANT=true
[2020-06-20 19:16:45,171 INFO  L122   nArgumentSynthesizer]: Termination Analysis Settings:
Termination analysis: LINEAR_WITH_GUESSES
Number of strict supporting invariants: 1
Number of non-strict supporting invariants: 0
Consider only non-deceasing supporting invariants: true
Simplify termination arguments: true
Simplify supporting invariants: trueOverapproximate stem: false
[2020-06-20 19:16:45,172 WARN  L334   nArgumentSynthesizer]: Using a linear SMT query and a templates of degree > 0, hence this method is incomplete.
[2020-06-20 19:16:45,172 INFO  L339   nArgumentSynthesizer]: Template has degree 4.
[2020-06-20 19:16:45,172 INFO  L352   nArgumentSynthesizer]: There is no stem transition; disabling supporting invariant generation.
[2020-06-20 19:16:45,173 INFO  L205   nArgumentSynthesizer]: 1 stem disjuncts
[2020-06-20 19:16:45,173 INFO  L206   nArgumentSynthesizer]: 4 loop disjuncts
[2020-06-20 19:16:45,173 INFO  L207   nArgumentSynthesizer]: 6 template conjuncts.
[2020-06-20 19:16:45,178 INFO  L402   nArgumentSynthesizer]: We have 24 Motzkin's Theorem applications.
[2020-06-20 19:16:45,179 INFO  L403   nArgumentSynthesizer]: A total of 0 supporting invariants were added.
[2020-06-20 19:16:45,190 INFO  L530          LassoAnalysis]: Proving termination failed for this template and these settings.
[2020-06-20 19:16:45,204 INFO  L489     LassoRankerStarter]: LassoRanker could not prove termination or nontermination of the given linear lasso program.
Templates: AffineTemplate NestedTemplate NestedTemplate NestedTemplate MultiphaseTemplate ComposedLexicographicTemplate PiecewiseTemplate ParallelTemplate
[2020-06-20 19:16:45,204 INFO  L132        PluginConnector]: ------------------------ END LassoRanker----------------------------
[2020-06-20 19:16:45,205 INFO  L168              Benchmark]: Toolchain (without parser) took 4090.18 ms. Allocated memory was 514.9 MB in the beginning and 532.2 MB in the end (delta: 17.3 MB). Free memory was 471.4 MB in the beginning and 452.8 MB in the end (delta: 18.6 MB). Peak memory consumption was 118.5 MB. Max. memory is 11.5 GB.
[2020-06-20 19:16:45,206 INFO  L168              Benchmark]: Boogie PL CUP Parser took 0.15 ms. Allocated memory is still 514.9 MB. Free memory is still 472.9 MB. There was no memory consumed. Max. memory is 11.5 GB.
[2020-06-20 19:16:45,206 INFO  L168              Benchmark]: Boogie Preprocessor took 25.47 ms. Allocated memory is still 514.9 MB. Free memory was 470.0 MB in the beginning and 468.6 MB in the end (delta: 1.3 MB). Peak memory consumption was 1.3 MB. Max. memory is 11.5 GB.
[2020-06-20 19:16:45,207 INFO  L168              Benchmark]: RCFGBuilder took 130.51 ms. Allocated memory is still 514.9 MB. Free memory was 468.6 MB in the beginning and 456.4 MB in the end (delta: 12.2 MB). Peak memory consumption was 12.2 MB. Max. memory is 11.5 GB.
[2020-06-20 19:16:45,208 INFO  L168              Benchmark]: LassoRanker took 3924.19 ms. Allocated memory was 514.9 MB in the beginning and 532.2 MB in the end (delta: 17.3 MB). Free memory was 456.4 MB in the beginning and 452.8 MB in the end (delta: 3.6 MB). Peak memory consumption was 103.6 MB. Max. memory is 11.5 GB.
[2020-06-20 19:16:45,210 INFO  L336   ainManager$Toolchain]: #######################  End [Toolchain 1] #######################
 --- Results ---
 * Results from de.uni_freiburg.informatik.ultimate.core:
  - StatisticsResult: Toolchain Benchmarks
    Benchmark results are:
 * Boogie PL CUP Parser took 0.15 ms. Allocated memory is still 514.9 MB. Free memory is still 472.9 MB. There was no memory consumed. Max. memory is 11.5 GB.
 * Boogie Preprocessor took 25.47 ms. Allocated memory is still 514.9 MB. Free memory was 470.0 MB in the beginning and 468.6 MB in the end (delta: 1.3 MB). Peak memory consumption was 1.3 MB. Max. memory is 11.5 GB.
 * RCFGBuilder took 130.51 ms. Allocated memory is still 514.9 MB. Free memory was 468.6 MB in the beginning and 456.4 MB in the end (delta: 12.2 MB). Peak memory consumption was 12.2 MB. Max. memory is 11.5 GB.
 * LassoRanker took 3924.19 ms. Allocated memory was 514.9 MB in the beginning and 532.2 MB in the end (delta: 17.3 MB). Free memory was 456.4 MB in the beginning and 452.8 MB in the end (delta: 3.6 MB). Peak memory consumption was 103.6 MB. Max. memory is 11.5 GB.
 * Results from de.uni_freiburg.informatik.ultimate.plugins.analysis.lassoranker:
  - NoResult [Line: 1]: LassoRanker could not prove termination
    LassoRanker could not prove termination or nontermination of the given linear lasso program.
Templates: AffineTemplate NestedTemplate NestedTemplate NestedTemplate MultiphaseTemplate ComposedLexicographicTemplate PiecewiseTemplate ParallelTemplate
RESULT: Ultimate could not prove your program: Toolchain returned no result.
Received shutdown request...
Ultimate:
GTK+ Version Check
